<?xml version="1.0" ?>
<!DOCTYPE Board SYSTEM "board-schema.dtd">
<Board>
  <Privileges>
	<Properties>
                    <Wood value="1"/>
                    <Stones value="1"/>
                    <Servants value="0"/>
                    <Coins value="0"/>
                    <MilitaryPoints value="0"/>
                    <VictoryPoints value="0"/>
                    <FaithPoints value="0"/>
        </Properties>
	<Properties>
                    <Wood value="0"/>
                    <Stones value="0"/>
                    <Servants value="2"/>
                    <Coins value="0"/>
                    <MilitaryPoints value="0"/>
                    <VictoryPoints value="0"/>
                    <FaithPoints value ="0"/>
        </Properties>
	<Properties>
                    <Wood value="0"/>
                    <Stones value="0"/>
                    <Servants value="0"/>
                    <Coins value="2"/>
                    <MilitaryPoints value="0"/>
                    <VictoryPoints value="0"/>
                    <FaithPoints value="0"/>
        </Properties>
	<Properties>
                    <Wood value="0"/>
                    <Stones value="0"/>
                    <Servants value="0"/>
                    <Coins value="0"/>
                    <MilitaryPoints value="2"/>
                    <VictoryPoints value="0"/>
                    <FaithPoints value ="0"/>
        </Properties>
	<Properties>
                    <Wood value="0"/>
                    <Stones value="0"/>
                    <Servants value="0"/>
                    <Coins value="0"/>
                    <MilitaryPoints value="0"/>
                    <VictoryPoints value="0"/>
                    <FaithPoints value="1"/>
        </Properties>
   </Privileges> 
   <InitialProperties>
	<Properties>
                    <Wood value="2"/>
                    <Stones value="2"/>
                    <Servants value="3"/>
                    <Coins value="5"/>
                    <MilitaryPoints value="0"/>
                    <VictoryPoints value="0"/>
                    <FaithPoints value ="0"/>
        </Properties>
	<Properties>
                    <Wood value="2"/>
                    <Stones value="2"/>
                    <Servants value="3"/>
                    <Coins value="6"/>
                    <MilitaryPoints value="0"/>
                    <VictoryPoints value="0"/>
                    <FaithPoints value ="0"/>
        </Properties>
	<Properties>
                    <Wood value="2"/>
                    <Stones value="2"/>
                    <Servants value="3"/>
                    <Coins value="7"/>
                    <MilitaryPoints value="0"/>
                    <VictoryPoints value="0"/>
                    <FaithPoints value ="0"/>
        </Properties>
	<Properties>
                    <Wood value="2"/>
                    <Stones value="2"/>
                    <Servants value="3"/>
                    <Coins value="8"/>
                    <MilitaryPoints value="2"/>
                    <VictoryPoints value="0"/>
                    <FaithPoints value ="0"/>
        </Properties>
  </InitialProperties>
	<CardBonuses>
		<TerritoryBonus>
			<Properties>
                		    <Wood value="2"/>
                		    <Stones value="2"/>
               			     <Servants value="3"/>
               			     <Coins value="8"/>
                		    <MilitaryPoints value="2"/>
                		    <VictoryPoints value="0"/>
              			      <FaithPoints value ="0"/>
        		</Properties>
			<Properties>
                		    <Wood value="2"/>
                		    <Stones value="2"/>
               			     <Servants value="3"/>
               			     <Coins value="8"/>
                		    <MilitaryPoints value="2"/>
                		    <VictoryPoints value="0"/>
              			      <FaithPoints value ="0"/>
        		</Properties>
			<Properties>
                		    <Wood value="2"/>
                		    <Stones value="2"/>
               			     <Servants value="3"/>
               			     <Coins value="8"/>
                		    <MilitaryPoints value="2"/>
                		    <VictoryPoints value="0"/>
              			      <FaithPoints value ="0"/>
        		</Properties>
			<Properties>
                		    <Wood value="2"/>
                		    <Stones value="2"/>
               			     <Servants value="3"/>
               			     <Coins value="8"/>
                		    <MilitaryPoints value="2"/>
                		    <VictoryPoints value="0"/>
              			      <FaithPoints value ="0"/>
        		</Properties>
			<Properties>
                		    <Wood value="2"/>
                		    <Stones value="2"/>
               			     <Servants value="3"/>
               			     <Coins value="8"/>
                		    <MilitaryPoints value="2"/>
                		    <VictoryPoints value="0"/>
              			      <FaithPoints value ="0"/>
        		</Properties>
			<Properties>
                		    <Wood value="2"/>
                		    <Stones value="2"/>
               			     <Servants value="3"/>
               			     <Coins value="8"/>
                		    <MilitaryPoints value="2"/>
                		    <VictoryPoints value="0"/>
              			      <FaithPoints value ="0"/>
        		</Properties>
		</TerritoryBonus>
		<BuildingBonus>
			<Properties>
                		    <Wood value="2"/>
                		    <Stones value="2"/>
               			     <Servants value="3"/>
               			     <Coins value="8"/>
                		    <MilitaryPoints value="2"/>
                		    <VictoryPoints value="0"/>
              			      <FaithPoints value ="0"/>
        		</Properties>
			<Properties>
                		    <Wood value="2"/>
                		    <Stones value="2"/>
               			     <Servants value="3"/>
               			     <Coins value="8"/>
                		    <MilitaryPoints value="2"/>
                		    <VictoryPoints value="0"/>
              			      <FaithPoints value ="0"/>
        		</Properties>
			<Properties>
                		    <Wood value="2"/>
                		    <Stones value="2"/>
               			     <Servants value="3"/>
               			     <Coins value="8"/>
                		    <MilitaryPoints value="2"/>
                		    <VictoryPoints value="0"/>
              			      <FaithPoints value ="0"/>
        		</Properties>
			<Properties>
                		    <Wood value="2"/>
                		    <Stones value="2"/>
               			     <Servants value="3"/>
               			     <Coins value="8"/>
                		    <MilitaryPoints value="2"/>
                		    <VictoryPoints value="0"/>
              			      <FaithPoints value ="0"/>
        		</Properties>
			<Properties>
                		    <Wood value="2"/>
                		    <Stones value="2"/>
               			     <Servants value="3"/>
               			     <Coins value="8"/>
                		    <MilitaryPoints value="2"/>
                		    <VictoryPoints value="0"/>
              			      <FaithPoints value ="0"/>
        		</Properties>
			<Properties>
                		    <Wood value="2"/>
                		    <Stones value="2"/>
               			     <Servants value="3"/>
               			     <Coins value="8"/>
                		    <MilitaryPoints value="2"/>
                		    <VictoryPoints value="0"/>
              			      <FaithPoints value ="0"/>
        		</Properties>
		</BuildingBonus>
		<CharacterBonus>
			<Properties>
                		    <Wood value="2"/>
                		    <Stones value="2"/>
               			     <Servants value="3"/>
               			     <Coins value="8"/>
                		    <MilitaryPoints value="2"/>
                		    <VictoryPoints value="0"/>
              			      <FaithPoints value ="0"/>
        		</Properties>
			<Properties>
                		    <Wood value="2"/>
                		    <Stones value="2"/>
               			     <Servants value="3"/>
               			     <Coins value="8"/>
                		    <MilitaryPoints value="2"/>
                		    <VictoryPoints value="0"/>
              			      <FaithPoints value ="0"/>
        		</Properties>
			<Properties>
                		    <Wood value="2"/>
                		    <Stones value="2"/>
               			     <Servants value="3"/>
               			     <Coins value="8"/>
                		    <MilitaryPoints value="2"/>
                		    <VictoryPoints value="0"/>
              			      <FaithPoints value ="0"/>
        		</Properties>
			<Properties>
                		    <Wood value="2"/>
                		    <Stones value="2"/>
               			     <Servants value="3"/>
               			     <Coins value="8"/>
                		    <MilitaryPoints value="2"/>
                		    <VictoryPoints value="0"/>
              			      <FaithPoints value ="0"/>
        		</Properties>
			<Properties>
                		    <Wood value="2"/>
                		    <Stones value="2"/>
               			     <Servants value="3"/>
               			     <Coins value="8"/>
                		    <MilitaryPoints value="2"/>
                		    <VictoryPoints value="0"/>
              			      <FaithPoints value ="0"/>
        		</Properties>
			<Properties>
                		    <Wood value="2"/>
                		    <Stones value="2"/>
               			     <Servants value="3"/>
               			     <Coins value="8"/>
                		    <MilitaryPoints value="2"/>
                		    <VictoryPoints value="0"/>
              			      <FaithPoints value ="0"/>
        		</Properties>
		</CharacterBonus>
		<VentureBonus>
			<Properties>
                		    <Wood value="2"/>
                		    <Stones value="2"/>
               			     <Servants value="3"/>
               			     <Coins value="8"/>
                		    <MilitaryPoints value="2"/>